Nombre Oficial;Comuna;Vía;Número;Dirección;Teléfono;Tiene Servicio de Urgencia;Tipo de Urgencia;Tipo de SAPU
Posta de Salud Rural San Marcos;Iquique;Calle;S/N;Localidad de San Marcos;Pendiente;NO;No Aplica;No Aplica
Policlínico Teck Quebrada Blanca;Pica;Calle;S/N;Faena minera Teck quebrada blanca, campamento 1700;56 9 6207 9063;NO;No Aplica;No Aplica
Clínica Coposa Cía. Minera Doña Inés de Collahuasi;Pica;Calle;S/N;Coposa Hostal Pabellón del Inca;572516621;NO;No Aplica;No Aplica
Posta de Salud Rural Chanavayita;Iquique;Calle;S/N;Aldea de Chanavayita;Pendiente;NO;No Aplica;No Aplica
SUR Chanavayita;Iquique;Calle;S/N;Aldea de Chanavayita;Pendiente;SI;Urgencia Ambulatoria (SUR);No Aplica
Posta de Salud Rural Matilla;Pica;Calle;S/N;Matilla;Pendiente;NO;No Aplica;No Aplica
Centro de Salud Familiar Dr. Juan Márquez Vismarra;Pica;Calle;S/N;Balmaceda;572741306;NO;No Aplica;No Aplica
SUR Pica;Pica;Calle;S/N;Balmaceda;Pendiente;SI;Urgencia Ambulatoria (SUR);No Aplica
Posta de Salud Rural La Huayca;Pozo Almonte;Calle;S/N;Sector La Huayca;Pendiente;NO;No Aplica;No Aplica
Posta de Salud Rural La Tirana;Pozo Almonte;Calle;S/N;General Ibáñez;Pendiente;NO;No Aplica;No Aplica
Centro de Diálisis Alto Hospicio;Alto Hospicio;Calle;3125;Inglaterra, Sector La Pampa;572324823;NO;No Aplica;No Aplica
Centro de Salud Familiar Dr. Héctor Reyno Gutiérrez;Alto Hospicio;Calle;3080;Naciones Unidas;Pendiente;NO;No Aplica;No Aplica
Centro de Salud Familiar Dr. Yandry Añazco Montero;Alto Hospicio;Calle;4320;Los Lagos;572584401;NO;No Aplica;No Aplica
COSAM Enrique París;Alto Hospicio;Calle;S/N;Santa Rosa;573079321;NO;No Aplica;No Aplica
SAR La Tortuga;Alto Hospicio;Calle;3355;Santa Rosa;Pendiente;SI;Urgencia ambulatoria (SAR);No Aplica
Centro Comunitario de Salud Familiar La Tortuga;Alto Hospicio;Calle;3355;Santa Rosa;Pendiente;NO;No Aplica;No Aplica
Centro de Salud Familiar Pedro Pulgar Melgarejo;Alto Hospicio;Calle;S/N;Los Álamos;800500108;NO;No Aplica;No Aplica
"Centro de Atención en Salud ""Nursing Care""";Iquique;Avenida;3717;Francisco Bilbao (Oficina 11);9 8418 4009;NO;No Aplica;No Aplica
Centro de Salud Familiar Pozo Almonte;Pozo Almonte;Calle;276;Balmaceda;572761214;NO;No Aplica;No Aplica
"LABORATORIO CLINICO ""BIOANALYSIS""";Iquique;Calle;3432;Salvador Allende;56 9 83887253;NO;No Aplica;No Aplica
Policlínico de Atención Primaria del Centro de Detención Preventiva de Pozo Almonte;Pozo Almonte;Calle;624;Libertad;572751228;NO;No Aplica;No Aplica
Laboratorio Clínico Playa Brava;Iquique;Calle;3327;José Francisco Vergara;572393544;NO;No Aplica;No Aplica
Centro de Diálisis Alto Medicen;Alto Hospicio;Calle;2251;El Pilón, sitio B;572267000;NO;No Aplica;No Aplica
COSAM Salvador Allende;Iquique;Calle;S/N;Céspedes;Pendiente;NO;No Aplica;No Aplica
SAR Sur de Iquique;Iquique;Calle;S/N;Playa El Águila;572536836;SI;Urgencia ambulatoria (SAR);No Aplica
Centro de Salud Familiar Sur de Iquique;Iquique;Calle;S/N;Playa El Águila;800500109;NO;No Aplica;No Aplica
Centro de Diálisis la Tirana;Iquique;Avenida;3095;La Tirana;572447964;NO;No Aplica;No Aplica
Centro Comunitario de Salud Familiar El Boro;Alto Hospicio;Calle;S/N;Calle 4;572406750;NO;No Aplica;No Aplica
SAPU El Boro;Alto Hospicio;Calle;2765;Salitrera Domeyko;562581636;SI;Urgencia Ambulatoria (SAPU);Corto
Centro de Salud Universidad Arturo Prat;Iquique;Avenida;2120;Arturo Prat;572394745;NO;No Aplica;No Aplica
Estadio Tierra de Campeones;Iquique;Avenida;2903;Salvador Allende Gossens;Pendiente;NO;No Aplica;No Aplica
Clínica Establecimiento Penitenciario Alto Hospicio;Alto Hospicio;Calle;S/N;Ruta A16 Km. 6;572512602;NO;No Aplica;No Aplica
Centro de Diálisis Corporación Paúl Harris;Iquique;Calle;2110;Armada de Chile;572431880;NO;No Aplica;No Aplica
Centro de Diálisis Medicen;Iquique;Avenida;1934;Tadeo Haenke;572322175;NO;No Aplica;No Aplica
Laboratorio Médico Bioclinic Ltda.;Iquique;Calle;2889;Juan Antonio Ríos;572277483 / 995440744;NO;No Aplica;No Aplica
Centro de Salud Familiar Cirujano Guzmán;Iquique;Avenida;2763;Pedro Prado;800500106;NO;No Aplica;No Aplica
SAPU Cirujano Guzmán;Iquique;Avenida;2736;Pedro Prado;572573574;SI;Urgencia Ambulatoria (SAPU);Corto
Policlínico FACH de Iquique;Iquique;Calle;1605;Diego Portales;572792500 - 572792570;NO;No Aplica;No Aplica
Centro Clínico Militar Iquique;Iquique;Calle;1041;Diego Portales;572518182;NO;No Aplica;No Aplica
Centro de Salud Familiar Cirujano Aguirre;Iquique;Pasaje;S/N;3 Pintados;800500105;NO;No Aplica;No Aplica
SAPU Cirujano Aguirre;Iquique;Pasaje;S/N;Chintaguay;572573568;SI;Urgencia Ambulatoria (SAPU);Corto
Vacunatorio Inmuno Vida Spa;Iquique;Calle;1701;Barros Arana;56 966475246;NO;No Aplica;No Aplica
Laboratorio Clínico de Nueva Clínica Tarapacá;Iquique;Calle;1550;Barros Arana;572421566;NO;No Aplica;No Aplica
Instituto Teletón Iquique;Iquique;Calle;999;José Joaquín Pérez;572588888;NO;No Aplica;No Aplica
Policlínico del Trabajador AChS Iquique;Iquique;Calle;1517;Amunategui;572402914;NO;No Aplica;No Aplica
Clínica Tarapacá;Iquique;Calle;1550;Barros Arana;572397000;SI;Urgencia Hospitalaria (UEH);No Aplica
Centro de Diálisis Iquique;Iquique;Calle;1677;Orella;572422242;NO;No Aplica;No Aplica
Centro de Salud Mutual CChC Iquique;Iquique;Calle;769;Orella;572422735;NO;No Aplica;No Aplica
Laboratorio Clínico Arauco Ltda.;Iquique;Calle;1246;Ramírez;572415240;NO;No Aplica;No Aplica
Laboratorio Clínico Automatizado Elmo;Iquique;Calle;1229;Vivar;572412599;NO;No Aplica;No Aplica
Servicio Médico Legal Iquique;Iquique;Calle;2210;O'Higgins;(57)413925;NO;No Aplica;No Aplica
Centro Médico y Dental MegaSalud Iquique;Iquique;Calle;1162;Ramírez;572510540;NO;No Aplica;No Aplica
Clínica Iquique;Iquique;Calle;103;Bernardo O'Higgins;572393200;SI;Urgencia Hospitalaria (UEH);No Aplica
Vacunatorio Sonrisa Infantil;Iquique;Calle;1011;Aníbal Pinto;572420708;NO;No Aplica;No Aplica
BLUELAB Laboratorio Biología Molecular;Iquique;Avenida;103;Bernardo O’Higgins, 5° piso, of. 504-505;600 718 6000;NO;No Aplica;No Aplica
Policlínico Carabineros de Iquique;Iquique;Calle;1105;Pedro Lagos;572557040;NO;No Aplica;No Aplica
Laboratorio Clínico Costanera;Iquique;Calle;1090;Pedro Lagos;572332877;NO;No Aplica;No Aplica
Laboratorio Clínico Iquilab;Iquique;Calle;800;Latorre con Obispo Labbé;572391242;NO;No Aplica;No Aplica
Clínica Dental Móvil Simple. Pat. RW6740 (Iquique);Iquique;Calle;1846;Thompson;572406100;NO;No Aplica;No Aplica
Policlínico Naval de Iquique;Iquique;Pasaje;1055;Isaza;572517187;NO;No Aplica;No Aplica
Unidad de Salud Funcionario S.S. Iquique;Iquique;Calle;815;Aníbal Pinto;Pendiente;NO;No Aplica;No Aplica
Actividades gestionadas por la Dirección del Servicio para apoyo de la Red (S.S de Iquique);Iquique;Calle;815;Aníbal Pinto;Pendiente;NO;No Aplica;No Aplica
PRAIS (S.S. Iquique);Iquique;Calle;815;Aníbal Pinto;Pendiente;NO;No Aplica;No Aplica
PAME Hospital de Iquique;Iquique;Calle;502;Héroes de la Concepción;Pendiente;NO;No Aplica;No Aplica
Hospital Dr. Ernesto Torres Galdames (Iquique);Iquique;Calle;502;Héroes de la Concepción;572575861;SI;Urgencia Hospitalaria (UEH);No Aplica
Centro Odontológico Uno Salud Dental Iquique;Iquique;Calle;630;Serrano;227634497;NO;No Aplica;No Aplica
COSAM Dr. Jorge Seguel Cáceres;Iquique;Calle;493;Serrano;572613668;NO;No Aplica;No Aplica
Laboratorio Clínico Bionet S.A. - Iquique;Iquique;Calle;385;San Martín;572425174;NO;No Aplica;No Aplica
Centro de Atención Instituto de Seguridad del Trabajador Iquique;Iquique;Calle;261;Patricio Lynch;572425667;NO;No Aplica;No Aplica
Clinicum Laboratorio Automatizado Ltda.;Iquique;Calle;731;Esmeralda;572496331;NO;No Aplica;No Aplica
Policlínico Centro de Cumplimiento Penitenciario Iquique;Iquique;Calle;S/N;Estación;572407900;NO;No Aplica;No Aplica
Centro Comunitario de Salud Familiar Cerro Esmeralda;Iquique;Calle;S/N;Ferrocarril;Pendiente;NO;No Aplica;No Aplica
SAPU Cirujano Videla;Iquique;Calle;S/N;Obispo Labbé;572329704;SI;Urgencia Ambulatoria (SAPU);Corto
Centro de Salud Familiar Cirujano Videla;Iquique;Calle;S/N;Obispo Labbé;800500107;NO;No Aplica;No Aplica
Policlínico De La Compañía Minera Cerro Colorado S.A.;Pozo Almonte;Calle;S/N;Camino a Mamiña, campamento minero Cerro Colorado;572404200-934319555;NO;No Aplica;No Aplica
Posta de Salud Rural Mamiña;Pozo Almonte;Calle;S/N;Santa Rosa;Pendiente;NO;No Aplica;No Aplica
Centro de Salud Familiar Dr. Amador Neghme Rodríguez;Huara;Calle;S/N;Eleuterio Ramírez;Pendiente;NO;No Aplica;No Aplica
SAPU Huara;Huara;Calle;S/N;Ramírez;572751590;SI;Urgencia Ambulatoria (SAPU);Corto
SUR Tarapacá;Huara;Calle;S/N;Caserío de Tarapacá;Pendiente;SI;Urgencia Ambulatoria (SUR);No Aplica
Posta de Salud Rural Tarapacá;Huara;Calle;S/N;Caserío de Tarapacá;Pendiente;NO;No Aplica;No Aplica
Posta de Salud Rural Pachica;Huara;Avenida;S/N;Comercio, esquina 18 de septiembre;Pendiente;NO;No Aplica;No Aplica
Posta de Salud Rural Cancosa;Pica;Calle;S/N;Caserío de Cancosa;Pendiente;NO;No Aplica;No Aplica
Posta de Salud Rural Sibaya;Huara;Calle;S/N;Caserío de Sibaya;Pendiente;NO;No Aplica;No Aplica
Posta de Salud Rural Pisagua;Huara;Avenida;S/N;Arturo Prat;Pendiente;NO;No Aplica;No Aplica
Posta de Salud Rural Chiapa;Huara;Calle;S/N;Caserío de Chiapa;Pendiente;NO;No Aplica;No Aplica
Posta de Salud Rural Cariquima;Colchane;Calle;S/N;Sector de Cariquima;Pendiente;NO;No Aplica;No Aplica
SUR Cariquima;Colchane;Calle;S/N;Sector de Cariquima;Pendiente;SI;Urgencia Ambulatoria (SUR);No Aplica
Posta de Salud Rural Moquella;Camiña;Calle;S/N;Caserío de Moquella;Pendiente;NO;No Aplica;No Aplica
CEAR Camiña;Camiña;Calle;S/N;Arturo Prat;958143226;SI;Ambulatoria CEAR;No Aplica
Centro de Salud Familiar Camiña;Camiña;Calle;S/N;Caserío de Camiña;Pendiente;NO;No Aplica;No Aplica
SUR Camiña;Camiña;Calle;S/N;Caserío de Camiña;Pendiente;SI;Urgencia Ambulatoria (SUR);No Aplica
SUR Colchane;Colchane;Calle;S/N;Sector de Colchane;Pendiente;SI;Urgencia Ambulatoria (SUR);No Aplica
CEAR Colchane;Colchane;Avenida;S/N;Teniente González;932509291;SI;Ambulatoria CEAR;No Aplica
Centro de Salud Familiar Colchane;Colchane;Calle;S/N;Sector de Colchane;Pendiente;NO;No Aplica;No Aplica
Posta de Salud Rural Enquelga;Colchane;Calle;S/N;Sector Enquelga;Pendiente;NO;No Aplica;No Aplica
Unidad de Vacunación Móvil de Tarapacá;Iquique;No Aplica;No Aplica;No Aplica;Pendiente;NO;No Aplica;No Aplica
SAR Pozo Almonte;Pozo Almonte;Calle;156;Caliche;572405180;SI;Urgencia Ambulatoria (SAPU);Pendiente
SAPU Dr. Héctor Reyno Gutiérrez;Alto Hospicio;Calle;3080;Naciones Unidas;Pendiente;SI;Urgencia Ambulatoria (SAPU);Corto
Hospital de Día Infanto-Adolescente (HDIA);Iquique;Calle;1469;Hernán Fuenzalida;Pendiente;NO;No Aplica;No Aplica
LABORATORIO CLINICO ATMEDIC LTDA;Iquique;Avenida;1350;Héroes de la Concepción;56 9 4261 9867;NO;No Aplica;No Aplica
LABORATORIO CLÍNICO BAESCO;Iquique;Calle;777;Ernesto Riquelme;57 2 723594;NO;No Aplica;No Aplica
CENTROS MÉDICOS JENNER;Iquique;Calle;3432;Salvador Allende;(57) 226 2775;NO;No Aplica;No Aplica
SPA;;;;;;;;
Hospital de Alto Hospicio;Alto Hospicio;Calle;3240;Alemania 3240;572539064;Pendiente;Pendiente;No Aplica
